{
  "schema_version": "0.1",
  "catalog_id": "routing-catalog",
  "version": "1",
  "created_at": "2026-09-29T14:00:00Z",
  "targets": [
    {
      "target_id": "target-fast",
      "version": "1",
      "status": "active",
      "model_ref": {"id": "model-fast", "version": "1", "content_digest": {"algorithm": "sha256", "value": "aaaaaaaaaaaaaaaaaaaaaaaaaaaaaaaaaaaaaaaaaaaaaaaaaaaaaaaaaaaaaaaa"}},
      "provider_ref": {"id": "provider-local", "version": "1", "content_digest": {"algorithm": "sha256", "value": "bbbbbbbbbbbbbbbbbbbbbbbbbbbbbbbbbbbbbbbbbbbbbbbbbbbbbbbbbbbbbbbb"}},
      "runtime_ref": {"id": "runtime-local", "version": "1", "content_digest": {"algorithm": "sha256", "value": "cccccccccccccccccccccccccccccccccccccccccccccccccccccccccccccccc"}},
      "executor_ref": {"id": "executor-local", "version": "1", "content_digest": {"algorithm": "sha256", "value": "dddddddddddddddddddddddddddddddddddddddddddddddddddddddddddddddd"}},
      "execution_config_ref": {"id": "config-fast", "version": "1", "content_digest": {"algorithm": "sha256", "value": "eeeeeeeeeeeeeeeeeeeeeeeeeeeeeeeeeeeeeeeeeeeeeeeeeeeeeeeeeeeeeeee"}},
      "supported_role_refs": [{"id": "researcher", "version": "1", "content_digest": {"algorithm": "sha256", "value": "1111111111111111111111111111111111111111111111111111111111111111"}}],
      "supported_task_types": ["analysis"],
      "capabilities": [],
      "permission_ids": ["workspace-read"],
      "controls": [{"id": "timeout", "support": "supported", "evidence_refs": []}],
      "output_contract_refs": [{"id": "report-contract", "version": "1", "content_digest": {"algorithm": "sha256", "value": "2222222222222222222222222222222222222222222222222222222222222222"}}],
      "accepted_classifications": ["internal"],
      "context_limit_tokens": 8192,
      "max_output_tokens": 2048,
      "priority": 10,
      "routing_description": "Destino de menor latência para análises simples",
      "specialization_tags": ["fast-analysis"]
    },
    {
      "target_id": "target-quality",
      "version": "1",
      "status": "active",
      "model_ref": {"id": "model-quality", "version": "1", "content_digest": {"algorithm": "sha256", "value": "ffffffffffffffffffffffffffffffffffffffffffffffffffffffffffffffff"}},
      "provider_ref": {"id": "provider-local", "version": "1", "content_digest": {"algorithm": "sha256", "value": "bbbbbbbbbbbbbbbbbbbbbbbbbbbbbbbbbbbbbbbbbbbbbbbbbbbbbbbbbbbbbbbb"}},
      "runtime_ref": {"id": "runtime-local", "version": "1", "content_digest": {"algorithm": "sha256", "value": "cccccccccccccccccccccccccccccccccccccccccccccccccccccccccccccccc"}},
      "executor_ref": {"id": "executor-local", "version": "1", "content_digest": {"algorithm": "sha256", "value": "dddddddddddddddddddddddddddddddddddddddddddddddddddddddddddddddd"}},
      "execution_config_ref": {"id": "config-quality", "version": "1", "content_digest": {"algorithm": "sha256", "value": "9999999999999999999999999999999999999999999999999999999999999999"}},
      "supported_role_refs": [{"id": "researcher", "version": "1", "content_digest": {"algorithm": "sha256", "value": "1111111111111111111111111111111111111111111111111111111111111111"}}],
      "supported_task_types": ["analysis"],
      "capabilities": [],
      "permission_ids": ["workspace-read"],
      "controls": [{"id": "timeout", "support": "supported", "evidence_refs": []}],
      "output_contract_refs": [{"id": "report-contract", "version": "1", "content_digest": {"algorithm": "sha256", "value": "2222222222222222222222222222222222222222222222222222222222222222"}}],
      "accepted_classifications": ["internal"],
      "context_limit_tokens": 16384,
      "max_output_tokens": 4096,
      "priority": 5,
      "routing_description": "Destino para análises que priorizam qualidade",
      "specialization_tags": ["deep-analysis", "reporting"]
    }
  ],
  "catalog_hash": {"algorithm": "sha256", "value": "5f1e7569237f476b7e1a11d1c3f79bcb1f2522ef70dad4d9bf711ced245aaa5a"}
}
